{
  "schema_version": "1.0",
  "build_id": "fixture-20260821T120000Z",
  "generated_at_utc": "2026-08-21T14:38:00Z",
  "git_sha": "0000000",
  "season": 2026,
  "intrinsic_model_version": "intrinsic-cb-hurdle-v1",
  "arbitrage_mode": "baseline",
  "arbitrage_model_version": null,
  "arbitrage_method_version": "a0_rank_gap_v1",
  "market": {
    "source_id": "myfantasyleague_adp",
    "snapshot_key": "2026-08-20T14-38-44Z",
    "snapshot_at_utc": "2026-08-20T14:38:44Z",
    "source_as_of_utc": null,
    "cohort_rule_version": "phase5_cohort_v2",
    "confidence_rubric_version": "phase5_confidence_v1",
    "trend_rule_version": "phase5_trend_v1",
    "trend_available": false,
    "trend_history_snapshots": 2,
    "assignments": [
      {
        "scoring_preset": "STD",
        "league_size": 10,
        "cohort_id": "no-mock-no-keeper",
        "exact": false,
        "sufficient": false,
        "source_format_detail": "IS_KEEPER=N&IS_MOCK=0 (approximate cohort)",
        "failed_clauses": [
          "total_drafts 125 < 300"
        ]
      },
      {
        "scoring_preset": "HALF",
        "league_size": 10,
        "cohort_id": "no-mock-no-keeper",
        "exact": false,
        "sufficient": false,
        "source_format_detail": "IS_KEEPER=N&IS_MOCK=0 (approximate cohort)",
        "failed_clauses": [
          "total_drafts 125 < 300"
        ]
      },
      {
        "scoring_preset": "PPR",
        "league_size": 10,
        "cohort_id": "no-mock-no-keeper",
        "exact": false,
        "sufficient": false,
        "source_format_detail": "IS_KEEPER=N&IS_MOCK=0 (approximate cohort)",
        "failed_clauses": [
          "total_drafts 125 < 300"
        ]
      },
      {
        "scoring_preset": "STD",
        "league_size": 12,
        "cohort_id": "no-mock-no-keeper",
        "exact": false,
        "sufficient": false,
        "source_format_detail": "IS_KEEPER=N&IS_MOCK=0 (approximate cohort)",
        "failed_clauses": [
          "total_drafts 125 < 300"
        ]
      },
      {
        "scoring_preset": "HALF",
        "league_size": 12,
        "cohort_id": "no-mock-no-keeper",
        "exact": false,
        "sufficient": false,
        "source_format_detail": "IS_KEEPER=N&IS_MOCK=0 (approximate cohort)",
        "failed_clauses": [
          "total_drafts 125 < 300"
        ]
      },
      {
        "scoring_preset": "PPR",
        "league_size": 12,
        "cohort_id": "no-mock-no-keeper",
        "exact": false,
        "sufficient": false,
        "source_format_detail": "IS_KEEPER=N&IS_MOCK=0 (approximate cohort)",
        "failed_clauses": [
          "total_drafts 125 < 300"
        ]
      },
      {
        "scoring_preset": "STD",
        "league_size": 14,
        "cohort_id": "no-mock-no-keeper",
        "exact": false,
        "sufficient": false,
        "source_format_detail": "IS_KEEPER=N&IS_MOCK=0 (approximate cohort)",
        "failed_clauses": [
          "total_drafts 125 < 300"
        ]
      },
      {
        "scoring_preset": "HALF",
        "league_size": 14,
        "cohort_id": "no-mock-no-keeper",
        "exact": false,
        "sufficient": false,
        "source_format_detail": "IS_KEEPER=N&IS_MOCK=0 (approximate cohort)",
        "failed_clauses": [
          "total_drafts 125 < 300"
        ]
      },
      {
        "scoring_preset": "PPR",
        "league_size": 14,
        "cohort_id": "no-mock-no-keeper",
        "exact": false,
        "sufficient": false,
        "source_format_detail": "IS_KEEPER=N&IS_MOCK=0 (approximate cohort)",
        "failed_clauses": [
          "total_drafts 125 < 300"
        ]
      }
    ],
    "confidence_counts": {
      "low": 81
    },
    "unpriced_top_players": 9
  },
  "player_status": {
    "players": 9,
    "sleeper_available": true,
    "sleeper_matched": 9,
    "sleeper_identity_conflicts": 0,
    "observed_at_utc": "2026-08-20T14:39:19Z",
    "source_ids": [
      "nflreadpy",
      "sleeper"
    ]
  },
  "supported_presets": [
    "redraft-10",
    "redraft-12",
    "redraft-14"
  ],
  "sources": [
    {
      "source_id": "myfantasyleague_adp",
      "status": "warning",
      "retrieved_at_utc": "2026-08-20T14:38:44Z",
      "source_as_of_utc": null,
      "record_count": 4364,
      "warnings": [
        "cohort_approximate",
        "cohort_insufficient"
      ]
    },
    {
      "source_id": "nflreadpy",
      "status": "pass",
      "retrieved_at_utc": "2026-08-21T14:38:00Z",
      "source_as_of_utc": null,
      "record_count": 732882,
      "warnings": []
    },
    {
      "source_id": "sleeper",
      "status": "pass",
      "retrieved_at_utc": "2026-08-20T14:39:19Z",
      "source_as_of_utc": null,
      "record_count": 12240,
      "warnings": []
    }
  ],
  "quality_gate": {
    "status": "pass",
    "critical_failures": 0,
    "warnings": 2
  },
  "warnings": [
    "tiers are published having not passed the frozen tier stability gate; read a tier as a group of comparable players, not as a hard line - membership is reproducible but boundary positions are not (ADR-035)",
    "top-150 board players with no market price are excluded, not filled in"
  ],
  "methodology_version": "phase4_intrinsic_v1"
}
